{
  "victim": { "class": "odfixture.ConfigVictimTest", "method": "expectsDefaultMode" },
  "polluters": [
    { "class": "odfixture.ConfigPolluterTest", "method": "pollute" }
  ],
  "original_failing_order": [
    { "class": "odfixture.MathUtilTest", "method": "addsTwoNumbers" },
    { "class": "odfixture.ConfigPolluterTest", "method": "pollute" },
    { "class": "odfixture.StringUtilTest", "method": "reversesAString" },
    { "class": "odfixture.ConfigVictimTest", "method": "expectsDefaultMode" }
  ],
  "reduced_sequence": [
    { "class": "odfixture.ConfigPolluterTest", "method": "pollute" },
    { "class": "odfixture.ConfigVictimTest", "method": "expectsDefaultMode" }
  ],
  "reproduction": {
    "successes": 20, "n": 20, "confidence": 0.95,
    "lower": 0.83887484172924, "upper": 1.0
  },
  "sequence_any_signature_failures": 20,
  "victim_alone": {
    "successes": 0, "n": 20, "confidence": 0.95,
    "lower": 0.0, "upper": 0.16112515827076002
  },
  "shared_resource": { "kind": "static-field", "class": "odfixture.Config", "field": "mode" },
  "polluter_write_location": { "class": "odfixture.ConfigPolluterTest", "method": "pollute", "bytecode_offset": 1 },
  "victim_read_location": { "class": "odfixture.ConfigVictimTest", "method": "expectsDefaultMode", "bytecode_offset": 1 },
  "failure_signature": {
    "exception_type": "java.lang.AssertionError",
    "message": "expected:<0> but was:<1>",
    "stack_trace": "at odfixture.ConfigVictimTest.expectsDefaultMode(ConfigVictimTest.java:10)"
  },
  "instrumentation_level": "static-only",
  "execution_record_reference": "eval/benchmark/logs/F1.json",
  "source_integrity": { "passed": true, "details": "No real source-integrity checker exists yet (Member 2's component) -- 'passed: true' is asserted by construction (plain Maven, no instrumentation involved), not independently checked." },
  "outcome": "VERIFIED",
  "unresolved_reason": null,
  "limitations": [
    "reproduction and victim_alone are REAL measured counts: od-fixture's F1 case was actually run 20 times each way via plain Maven inside maven:3.9-eclipse-temurin-8 on 2026-10-09 (eval/tools/run_real_reps.sh) -- not hand-picked. See docs/evidence-m3.md and eval/benchmark/logs/F1.json for the raw run.",
    "polluter_write_location/victim_read_location's bytecode_offset values (1, 1) are real -- verified independently via `javap -c -p` on the compiled classes (putstatic at offset 1 in ConfigPolluterTest#pollute, getstatic at offset 1 in ConfigVictimTest#expectsDefaultMode; JDK 8, 2026-10-09). No real static-bytecode-evidence EXTRACTOR exists yet in this repo (Member 1's component is still being built) -- these offsets were read by hand from javap, not produced by that component.",
    "original_failing_order includes two benign noise tests to illustrate what the minimiser would reduce away; reduced_sequence is what was actually run."
  ]
}
