{
  "victim": { "class": "com.example.OrderInsensitiveTest", "method": "checksSomething" },
  "polluters": [
    { "class": "com.example.SuspectedPolluterTest", "method": "mutatesSomething" }
  ],
  "original_failing_order": [
    { "class": "com.example.SuspectedPolluterTest", "method": "mutatesSomething" },
    { "class": "com.example.OrderInsensitiveTest", "method": "checksSomething" }
  ],
  "reduced_sequence": [
    { "class": "com.example.SuspectedPolluterTest", "method": "mutatesSomething" },
    { "class": "com.example.OrderInsensitiveTest", "method": "checksSomething" }
  ],
  "reproduction": {
    "successes": 0, "n": 20, "confidence": 0.95,
    "lower": 0.0, "upper": 0.16112515827076002
  },
  "sequence_any_signature_failures": 0,
  "victim_alone": {
    "successes": 0, "n": 20, "confidence": 0.95,
    "lower": 0.0, "upper": 0.16112515827076002
  },
  "shared_resource": { "kind": "static-field", "class": "com.example.Shared", "field": "counter" },
  "polluter_write_location": { "class": "com.example.SuspectedPolluterTest", "method": "mutatesSomething", "bytecode_offset": 2 },
  "victim_read_location": { "class": "com.example.OrderInsensitiveTest", "method": "checksSomething", "bytecode_offset": 4 },
  "failure_signature": {
    "exception_type": "java.lang.AssertionError",
    "message": "expected the originally-observed failure to recur",
    "stack_trace": "at com.example.OrderInsensitiveTest.checksSomething(OrderInsensitiveTest.java:9)"
  },
  "instrumentation_level": "static-only",
  "execution_record_reference": "illustrative-only: no real execution record backs this example",
  "source_integrity": { "passed": true, "details": "Illustrative: no modification detected to any instrumented class." },
  "outcome": "UNRESOLVED",
  "unresolved_reason": "NOT_REPRODUCED",
  "limitations": [
    "Hand-written illustrative example, not a recorded benchmark run -- see eval/examples/README.md.",
    "Demonstrates that a plausible resource edge is not enough on its own: the sequence must actually reproduce the failure, and here it never did in 20 attempts."
  ]
}
