{
  "victim": { "class": "com.example.PartiallyFlakyVictimTest", "method": "expectsCleanCounter" },
  "polluters": [
    { "class": "com.example.IntermittentPolluterTest", "method": "bumpsCounterUnderContention" }
  ],
  "original_failing_order": [
    { "class": "com.example.IntermittentPolluterTest", "method": "bumpsCounterUnderContention" },
    { "class": "com.example.PartiallyFlakyVictimTest", "method": "expectsCleanCounter" }
  ],
  "reduced_sequence": [
    { "class": "com.example.IntermittentPolluterTest", "method": "bumpsCounterUnderContention" },
    { "class": "com.example.PartiallyFlakyVictimTest", "method": "expectsCleanCounter" }
  ],
  "reproduction": {
    "successes": 12, "n": 20, "confidence": 0.95,
    "lower": 0.3865815006061295, "upper": 0.7811934677397184
  },
  "sequence_any_signature_failures": 12,
  "victim_alone": {
    "successes": 0, "n": 20, "confidence": 0.95,
    "lower": 0.0, "upper": 0.16112515827076002
  },
  "shared_resource": { "kind": "static-field", "class": "com.example.SharedCounter", "field": "value" },
  "polluter_write_location": { "class": "com.example.IntermittentPolluterTest", "method": "bumpsCounterUnderContention", "bytecode_offset": 4 },
  "victim_read_location": { "class": "com.example.PartiallyFlakyVictimTest", "method": "expectsCleanCounter", "bytecode_offset": 2 },
  "failure_signature": {
    "exception_type": "java.lang.AssertionError",
    "message": null,
    "stack_trace": "at com.example.PartiallyFlakyVictimTest.expectsCleanCounter(PartiallyFlakyVictimTest.java:11)"
  },
  "instrumentation_level": "static-only",
  "execution_record_reference": "illustrative-only: no real execution record backs this example",
  "source_integrity": { "passed": true, "details": "Illustrative: no modification detected to any instrumented class." },
  "outcome": "CANDIDATE",
  "unresolved_reason": null,
  "limitations": [
    "Hand-written illustrative example, not a recorded benchmark run -- see eval/examples/README.md. Entirely synthetic (com.example.* names), not tied to any real case in this repo.",
    "Counts are chosen to demonstrate the CANDIDATE row (reproduces, below the 0.70 Wilson lower-bound threshold, but with a supporting resource edge). None of od-fixture's F1-F3 cases produce this naturally -- they are deliberately deterministic (always 20/20 or 0/20 when the reduced sequence is repeated), confirmed by actually re-running them (see example_f1_verified.json, example_f3_verified.json). A real CANDIDATE case needs genuine run-to-run nondeterminism in how the pollution takes effect, which this fixture does not model."
  ]
}
