{
  "victim": {
    "class": "odfixture.NegativeFlakyTest",
    "method": "sometimesFails"
  },
  "polluters": [],
  "original_failing_order": [
    {
      "class": "odfixture.AlwaysEarlyVictimTest",
      "method": "expectsLateFlagUnset"
    },
    {
      "class": "odfixture.ConfigPolluterTest",
      "method": "pollute"
    },
    {
      "class": "odfixture.ConfigVictimTest",
      "method": "expectsDefaultMode"
    },
    {
      "class": "odfixture.EnvDependentNegativeTest",
      "method": "onlyFailsUnderCI"
    },
    {
      "class": "odfixture.FeaturePolluterTest",
      "method": "enableTurbo"
    },
    {
      "class": "odfixture.FeatureVictimTest",
      "method": "expectsTurboDisabled"
    },
    {
      "class": "odfixture.MathUtilTest",
      "method": "squaresANumber"
    },
    {
      "class": "odfixture.MathUtilTest",
      "method": "addsTwoNumbers"
    },
    {
      "class": "odfixture.NegativeAloneFailTest",
      "method": "alwaysFails"
    },
    {
      "class": "odfixture.NegativeFlakyTest",
      "method": "sometimesFails"
    }
  ],
  "reduced_sequence": [
    {
      "class": "odfixture.NegativeFlakyTest",
      "method": "sometimesFails"
    }
  ],
  "reproduction": {
    "successes": 9,
    "n": 20,
    "confidence": 0.95,
    "lower": 0.25819785813113566,
    "upper": 0.6579146576959403
  },
  "sequence_any_signature_failures": 9,
  "victim_alone": {
    "successes": 9,
    "n": 20,
    "confidence": 0.95,
    "lower": 0.25819785813113566,
    "upper": 0.6579146576959403
  },
  "shared_resource": null,
  "polluter_write_location": null,
  "victim_read_location": null,
  "failure_signature": {
    "exception_type": "java.lang.AssertionError",
    "message": "",
    "stack_trace": "org.junit.Assert.fail:87\norg.junit.Assert.assertTrue:42\norg.junit.Assert.assertTrue:53\nodfixture.NegativeFlakyTest.sometimesFails:24"
  },
  "instrumentation_level": "static-only",
  "execution_record_reference": "C:\\Users\\zarpa\\OneDrive\\Documents\\GitHub\\FlakeTracee\\eval\\reports\\flaketrace-records\\20261011T085725Z-odfixture.NegativeFlakyTest#sometimesFails.jsonl",
  "source_integrity": {
    "passed": true,
    "details": "23 files hashed (SHA-256) before and after; all identical"
  },
  "outcome": "UNRESOLVED",
  "unresolved_reason": "VICTIM_FAILS_ALONE",
  "limitations": [
    "instrumentation_level is static-only (Iteration 1); runtime instrumentation is Iteration 2."
  ],
  "order_exploration": {
    "order_given": false,
    "shuffled_orders_tried": 0,
    "orders_exhausted": false,
    "seed_base": 0,
    "reproducing_seed": null,
    "infrastructure_failures": 0
  }
}
